{
    "securityChecks": false,
    "OCIBundleDir": "/var/sarus/OCIBundleDir",
    "rootfsFolder": "rootfsFolder",
    "prefixDir": "/opt/sarus",
    "tempDir": "/tmp",
    "localRepositoryBaseDir" : "/home",
    "skopeoPath": "/usr/bin/skopeo",
    "umociPath": "/usr/bin/umoci",
    "mksquashfsPath": "/usr/sbin/mksquashfs",
    "initPath": "/opt/sarus/bin/init",
    "runcPath": "/usr/bin/runc.amd64",
    "ramFilesystemType": "tmpfs"
}
